{
  "$schema": "https://json-schema.org/draft/2020-12/schema",
  "$id": "https://github.com/Razdva122/clean-your-tv-lg-webos/showcase/schema.json",
  "title": "Reviewed community theme record",
  "description": "Structural schema; scripts/check-theme-submissions.cjs additionally checks source identity, cross-field paths, shared theme policy and local byte hashes. Review approval is the maintainer-reviewed merge, never an author-supplied flag.",
  "type": "object",
  "additionalProperties": false,
  "required": [
    "schemaVersion",
    "id",
    "title",
    "description",
    "author",
    "sourceRepository",
    "sourceCommit",
    "descriptorUrl",
    "descriptorSha256",
    "themeVersion",
    "themeApiVersion",
    "license",
    "creditsFile",
    "previewFiles",
    "tags",
    "addedAt",
    "reviewedAt",
    "evidence"
  ],
  "properties": {
    "schemaVersion": {
      "const": 1
    },
    "id": {
      "type": "string",
      "pattern": "^github:[a-z0-9][a-z0-9-]*/[a-z0-9][a-z0-9._-]*:[a-z0-9][a-z0-9-]{0,63}$"
    },
    "title": {
      "type": "string",
      "minLength": 1,
      "maxLength": 100,
      "pattern": "^[^<>\\u0000-\\u001f\\u007f]+$"
    },
    "description": {
      "type": "string",
      "minLength": 1,
      "maxLength": 1000,
      "pattern": "^[^<>\\u0000-\\u001f\\u007f]+$"
    },
    "author": {
      "type": "object",
      "additionalProperties": false,
      "required": [
        "name",
        "sourceProfile"
      ],
      "properties": {
        "name": {
          "type": "string",
          "minLength": 1,
          "maxLength": 100,
          "pattern": "^[^<>\\u0000-\\u001f\\u007f]+$"
        },
        "sourceProfile": {
          "type": "string",
          "pattern": "^https://github\\.com/[a-z0-9][a-z0-9-]*$"
        }
      }
    },
    "sourceRepository": {
      "type": "string",
      "pattern": "^https://github\\.com/[a-z0-9][a-z0-9-]*/[a-z0-9][a-z0-9._-]*$"
    },
    "sourceCommit": {
      "type": "string",
      "pattern": "^[a-f0-9]{40}$"
    },
    "descriptorUrl": {
      "type": "string",
      "maxLength": 500,
      "pattern": "^https://raw\\.githubusercontent\\.com/[a-z0-9][a-z0-9-]*/[a-z0-9][a-z0-9._-]*/[a-f0-9]{40}/(?:[A-Za-z0-9_./-]+/)?cytv-theme\\.json$"
    },
    "descriptorSha256": {
      "type": "string",
      "pattern": "^[a-f0-9]{64}$"
    },
    "themeVersion": {
      "type": "string",
      "maxLength": 64,
      "pattern": "^(0|[1-9][0-9]*)\\.(0|[1-9][0-9]*)\\.(0|[1-9][0-9]*)(?:-[0-9A-Za-z-]+(?:\\.[0-9A-Za-z-]+)*)?$"
    },
    "themeApiVersion": {
      "const": 1
    },
    "license": {
      "enum": [
        "MIT",
        "Apache-2.0",
        "BSD-2-Clause",
        "BSD-3-Clause",
        "ISC",
        "CC0-1.0",
        "CC-BY-4.0",
        "CC-BY-SA-4.0",
        "MIT AND CC-BY-SA-3.0",
        "LicenseRef-Personal-Fan-Theme"
      ]
    },
    "creditsFile": {
      "type": "string",
      "maxLength": 240,
      "pattern": "^[A-Za-z0-9_-]+(?:[./-][A-Za-z0-9_-]+)*$"
    },
    "previewFiles": {
      "type": "array",
      "minItems": 1,
      "maxItems": 4,
      "uniqueItems": true,
      "items": {
        "type": "string",
        "maxLength": 240,
        "pattern": "^[A-Za-z0-9_-]+(?:[./-][A-Za-z0-9_-]+)*$"
      }
    },
    "tags": {
      "type": "array",
      "maxItems": 6,
      "uniqueItems": true,
      "items": {
        "enum": [
          "dark",
          "light",
          "minimal",
          "colorful",
          "photographic",
          "high-contrast"
        ]
      }
    },
    "addedAt": {
      "type": "string",
      "format": "date"
    },
    "reviewedAt": {
      "type": "string",
      "format": "date"
    },
    "evidence": {
      "type": "array",
      "minItems": 1,
      "maxItems": 8,
      "items": {
        "type": "object",
        "additionalProperties": false,
        "required": [
          "kind",
          "summary"
        ],
        "properties": {
          "kind": {
            "enum": [
              "browser",
              "device"
            ]
          },
          "summary": {
            "type": "string",
            "minLength": 1,
            "maxLength": 1000,
            "pattern": "^[^<>\\u0000-\\u001f\\u007f]+$"
          },
          "url": {
            "type": "string",
            "pattern": "^https://github\\.com/[a-z0-9][a-z0-9-]*/[a-z0-9][a-z0-9._-]*/(?:issues|pull)/[0-9]+(?:#(?:issuecomment-[0-9]+|discussion_r[0-9]+))?$"
          }
        }
      }
    },
    "availability": {
      "enum": [
        "unavailable",
        "removed"
      ],
      "description": "Maintainer moderation state; omitted for an active reviewed version. Removed records generate only a stable tombstone detail page."
    }
  }
}
