{
  "schemaVersion": 1,
  "id": "github:razdva122/clean-your-tv-lg-theme:itachi",
  "title": "Itachi \u00b7 Sharingan",
  "description": "Dark Itachi wallpaper and CSS-only white logo effects. Original application images remain unchanged.",
  "author": {
    "name": "CYTV personal themes",
    "sourceProfile": "https://github.com/razdva122"
  },
  "sourceRepository": "https://github.com/razdva122/clean-your-tv-lg-theme",
  "sourceCommit": "1a599feadd6be33dc8fbaccd568f321883e76150",
  "descriptorUrl": "https://raw.githubusercontent.com/razdva122/clean-your-tv-lg-theme/a361b56c81f5dd0e13fd91e5bbd9ac6c40794c79/distributions/itachi/1.0.2/cytv-theme.json",
  "descriptorSha256": "a2d8b8ea998314b9afd28c41c97b80250baf96e26279b2f9dcd7c93417553240",
  "themeVersion": "1.0.2",
  "themeApiVersion": 1,
  "license": "LicenseRef-Personal-Fan-Theme",
  "creditsFile": "assets/razdva122--clean-your-tv-lg-theme--itachi/a2d8b8ea998314b9afd28c41c97b80250baf96e26279b2f9dcd7c93417553240/documents/1-c3140d23a7d02bf38a0a4071686d8f0b8def45ae6e2c808da2ebcc5a2c8f5675.txt",
  "previewFiles": [
    "assets/razdva122--clean-your-tv-lg-theme--itachi/a2d8b8ea998314b9afd28c41c97b80250baf96e26279b2f9dcd7c93417553240/assets/preview-3ae2eb0eae8076f627e93f1ad59d865d411ea587d681e2f4fb6c2a74308bbcc1.jpg"
  ],
  "tags": [
    "dark",
    "minimal",
    "high-contrast"
  ],
  "addedAt": "2026-10-29",
  "reviewedAt": "2026-10-30",
  "evidence": [
    {
      "kind": "browser",
      "summary": "Published toolkit v1.0.2 at a361b56c81f5dd0e13fd91e5bbd9ac6c40794c79 verified against local descriptor and hashed files. Real Root/No-root browser install, apply and offline restore were checked during the author-flow audit. Physical-TV acceptance remains untested."
    },
    {
      "kind": "browser",
      "summary": "Toolkit tag v1.0.2 and pinned remote bytes verified. Inline main Home preview tested in Root and No-root with external network blocked: all four themes apply, selected theme survives edition switch and original app order is retained. Browser only; physical-TV acceptance untested."
    }
  ]
}
