{
  "schemaVersion": 1,
  "id": "github:razdva122/clean-your-tv-lg-theme:glasshouse",
  "title": "Alpine",
  "description": "A quiet alpine panorama, large clock and one infinitely looping horizontal app ribbon.",
  "author": {
    "name": "Clean Your TV contributors",
    "sourceProfile": "https://github.com/razdva122"
  },
  "sourceRepository": "https://github.com/razdva122/clean-your-tv-lg-theme",
  "sourceCommit": "7af0aaf9826804f0cfa5ca5ef3dc08da751d3e4f",
  "descriptorUrl": "https://raw.githubusercontent.com/razdva122/clean-your-tv-lg-theme/02bba75b1d59f8b97c548b6ea3370e01402de341/distributions/alpine/1.4.2/cytv-theme.json",
  "descriptorSha256": "f12d022e0d5531fb0bc6e8c7a165195fdaecebd9b13d162751769af498d785f6",
  "themeVersion": "1.4.2",
  "themeApiVersion": 1,
  "license": "MIT AND CC-BY-SA-3.0",
  "creditsFile": "assets/razdva122--clean-your-tv-lg-theme--glasshouse/f12d022e0d5531fb0bc6e8c7a165195fdaecebd9b13d162751769af498d785f6/documents/1-8953561ba5bbc81c984c4e24789875ad45c74230377b314f38dd4eeeaafe6a7d.txt",
  "previewFiles": [
    "assets/razdva122--clean-your-tv-lg-theme--glasshouse/f12d022e0d5531fb0bc6e8c7a165195fdaecebd9b13d162751769af498d785f6/assets/preview-36450fd5d4dfa7205708fac3e50c5a5e2131be7bdf729c3e09e99ad957a3e4e4.png",
    "assets/razdva122--clean-your-tv-lg-theme--glasshouse/f12d022e0d5531fb0bc6e8c7a165195fdaecebd9b13d162751769af498d785f6/assets/library-preview-257f2e227508ea58cf125dd62fd87bd47230037617ad296a81f6bc077afea77e.png",
    "assets/razdva122--clean-your-tv-lg-theme--glasshouse/f12d022e0d5531fb0bc6e8c7a165195fdaecebd9b13d162751769af498d785f6/assets/inputs-preview-6bebabf41a5635965e0d7a5c6a83be6d76da5d0a710e260bb5d9662b8a96d4fb.png",
    "assets/razdva122--clean-your-tv-lg-theme--glasshouse/f12d022e0d5531fb0bc6e8c7a165195fdaecebd9b13d162751769af498d785f6/assets/settings-preview-69ea1f55a44d6e873da5a07d2dd6831e83f9a97819673b19bacb526d4058fa75.png"
  ],
  "tags": [
    "dark",
    "photographic",
    "minimal"
  ],
  "addedAt": "2026-10-28",
  "reviewedAt": "2026-10-28",
  "evidence": [
    {
      "kind": "browser",
      "summary": "Candidate browser review: actual Home renderer, looping ribbon, column policy, library wallpaper/focus, shortcut icons, Inputs and standard Settings isolation. Toolkit 21 tests passed. Synthetic apps and fixed-clock images; no physical-TV acceptance.",
      "url": "https://github.com/razdva122/clean-your-tv-lg-webos/pull/139"
    }
  ]
}
