{
  "schemaVersion": 1,
  "id": "github:razdva122/clean-your-tv-lg-theme:terminal",
  "title": "Channel",
  "description": "A readable teletext Home with numbered rows, a selected-app preview and matching app library.",
  "author": {
    "name": "Clean Your TV contributors",
    "sourceProfile": "https://github.com/razdva122"
  },
  "sourceRepository": "https://github.com/razdva122/clean-your-tv-lg-theme",
  "sourceCommit": "7af0aaf9826804f0cfa5ca5ef3dc08da751d3e4f",
  "descriptorUrl": "https://raw.githubusercontent.com/razdva122/clean-your-tv-lg-theme/02bba75b1d59f8b97c548b6ea3370e01402de341/distributions/channel/1.3.2/cytv-theme.json",
  "descriptorSha256": "d94f984c28be6903401f8748626679644c82e6de21b79a47eccd2359859658b0",
  "themeVersion": "1.3.2",
  "themeApiVersion": 1,
  "license": "MIT",
  "creditsFile": "assets/razdva122--clean-your-tv-lg-theme--terminal/d94f984c28be6903401f8748626679644c82e6de21b79a47eccd2359859658b0/documents/1-3432da793b6a2339c87e98db9d9d5b8f13f75464135f9befd5c99e0812988f41.txt",
  "previewFiles": [
    "assets/razdva122--clean-your-tv-lg-theme--terminal/d94f984c28be6903401f8748626679644c82e6de21b79a47eccd2359859658b0/assets/preview-44db60e9db5ea8752df62e1087adb9bd2c8c47ab577857ad03a2b7aa847341cb.png",
    "assets/razdva122--clean-your-tv-lg-theme--terminal/d94f984c28be6903401f8748626679644c82e6de21b79a47eccd2359859658b0/assets/inputs-preview-c087fc397a1af20a9f97fe24f3a37bb9acfd6ca12e3986a5453b355e09514374.png",
    "assets/razdva122--clean-your-tv-lg-theme--terminal/d94f984c28be6903401f8748626679644c82e6de21b79a47eccd2359859658b0/assets/settings-preview-b2d96b02e5e12ff43a53c3ee67f08d1a0850873d9ab64f7f4eeaca3604aba2ac.png"
  ],
  "tags": [
    "dark",
    "colorful",
    "high-contrast"
  ],
  "addedAt": "2026-10-28",
  "reviewedAt": "2026-10-28",
  "evidence": [
    {
      "kind": "browser",
      "summary": "Candidate browser review: actual Home renderer, numbered list and user column override, shortcut icons, app library focus, Inputs and standard Settings isolation. Toolkit 21 tests passed. Synthetic apps and fixed-clock images; no physical-TV acceptance.",
      "url": "https://github.com/razdva122/clean-your-tv-lg-webos/pull/139"
    }
  ]
}
